{
  "schemaVersion": "1.0.0",
  "reportId": "PVR-SYNTHETIC-AUDIO-001",
  "status": "COMPLETE",
  "candidate": {
    "candidateId": "synthetic-candidate-001",
    "artifactPath": "evidence/candidate.mp4",
    "sha256": "aaaaaaaaaaaaaaaaaaaaaaaaaaaaaaaaaaaaaaaaaaaaaaaaaaaaaaaaaaaaaaaa",
    "sourceRevision": "synthetic-revision-001",
    "renderProvenanceId": "synthetic-render-001"
  },
  "reviewer": {
    "domain": "audio-captions-synchronization",
    "contextId": "isolated-review-context-002",
    "readOnly": true,
    "executionReceipt": {
      "receipt": {
        "artifactPath": "execution-receipt.review-audio-finding.json",
        "sha256": "aaaaaaaaaaaaaaaaaaaaaaaaaaaaaaaaaaaaaaaaaaaaaaaaaaaaaaaaaaaaaaaa",
        "bytes": 1
      },
      "signature": {
        "artifactPath": "execution-receipt.review-audio-finding.ed25519",
        "sha256": "bbbbbbbbbbbbbbbbbbbbbbbbbbbbbbbbbbbbbbbbbbbbbbbbbbbbbbbbbbbbbbbb",
        "bytes": 64
      }
    },
    "startedAt": "2026-07-29T15:00:00.000Z",
    "completedAt": "2026-07-29T15:05:00.000Z"
  },
  "reviewIntegrity": {
    "canonicalRubric": {
      "artifactPath": "skills/product-demo-studio/references/killer-demo-playbook.md",
      "sha256": "cccccccccccccccccccccccccccccccccccccccccccccccccccccccccccccccc"
    },
    "verticalOverlay": null,
    "calibrationRecord": {
      "artifactPath": "evidence/reviewer-calibration.json",
      "sha256": "dddddddddddddddddddddddddddddddddddddddddddddddddddddddddddddddd"
    },
    "modelId": "synthetic-reviewer-model",
    "generatorReasoningReceived": false,
    "priorReviewsReceived": false
  },
  "evidencePackage": {
    "artifactPath": "evidence/evidence-package.json",
    "sha256": "bbbbbbbbbbbbbbbbbbbbbbbbbbbbbbbbbbbbbbbbbbbbbbbbbbbbbbbbbbbbbbbb"
  },
  "score": 94,
  "checks": [
    {"id": "narration-accuracy", "passed": true, "evidenceArtifactIds": ["audio-report"]},
    {"id": "pronunciation", "passed": true, "evidenceArtifactIds": ["audio-report"]},
    {"id": "pacing", "passed": true, "evidenceArtifactIds": ["audio-report"]},
    {"id": "loudness", "passed": true, "evidenceArtifactIds": ["audio-report"]},
    {"id": "clipping", "passed": true, "evidenceArtifactIds": ["audio-report"]},
    {"id": "music-balance", "passed": true, "evidenceArtifactIds": ["audio-report"]},
    {"id": "action-synchronization", "passed": false, "evidenceArtifactIds": ["sync-report"]},
    {"id": "pauses", "passed": true, "evidenceArtifactIds": ["audio-report"]},
    {"id": "result-holds", "passed": true, "evidenceArtifactIds": ["audio-report"]},
    {"id": "caption-accuracy", "passed": true, "evidenceArtifactIds": ["caption-report"]},
    {"id": "caption-timing", "passed": true, "evidenceArtifactIds": ["caption-report"]},
    {"id": "reading-speed", "passed": true, "evidenceArtifactIds": ["caption-report"]},
    {"id": "caption-layout", "passed": true, "evidenceArtifactIds": ["caption-report"]},
    {"id": "accessibility", "passed": true, "evidenceArtifactIds": ["caption-report"]}
  ],
  "domainPass": false,
  "findings": [
    {
      "schemaVersion": "1.0.0",
      "id": "PVF-AUDIO-SYNC-001",
      "category": "audio-captions-synchronization",
      "severity": "major",
      "fixClassification": "narration-audio",
      "location": {
        "startTimestampMs": 1000,
        "endTimestampMs": 2000,
        "startFrame": 30,
        "endFrame": 60,
        "fps": 30
      },
      "expectedBehavior": "The spoken payoff lands as the result becomes visible.",
      "observedBehavior": "The spoken payoff begins one second before the result becomes visible.",
      "impact": "The viewer hears the conclusion before seeing its supporting product evidence.",
      "evidence": [
        {
          "artifactId": "sync-report",
          "artifactPath": "evidence/synchronization-report.json",
          "sha256": "cccccccccccccccccccccccccccccccccccccccccccccccccccccccccccccccc",
          "description": "Word timestamps aligned to the deterministic frame timeline."
        }
      ],
      "concreteFix": {
        "summary": "Delay the payoff narration by one second.",
        "steps": [
          "Move the payoff narration cue from frame 30 to frame 60.",
          "Rerender and regenerate synchronization evidence."
        ]
      },
      "automatedValidation": {
        "command": "node scripts/check-synchronization.mjs evidence/candidate.mp4",
        "expectedResult": "The payoff cue starts within one frame of the visible result."
      },
      "confidence": 0.98
    }
  ],
  "summary": "One deterministic synchronization defect prevents the audio domain from passing."
}
